arc_id,oax_id,action,note
DE130101267_FionaMartin,,unlink,Tax lawyer UNSW (Emeritus Prof). ARC ORCID 0000-0001-6333-3652 confirmed. HC candidates are the Media & Communications professor at USyd. Correct OAX record lacks ORCID in OAX data.
DE180101348_HaotianWu,https://openalex.org/A5022332458,resolve,Pure mathematician at USyd. FOR=Pure Mathematics + inst I129604602 matches ORCID 0000-0001-8518-4109. Other HC candidates are different people.
LP110100040_GerryQuinn,https://openalex.org/A5105462855,resolve,OAX split record — same person (Gerry P. Quinn) across two OAX IDs. ORCID 0000-0003-4144-0355 confirmed but not registered in OAX. Keeping higher works_count record (wc=47 vs 42).
DE120103022_LonghuiLi,https://openalex.org/A5108910953,resolve,OAX split record — two OAX IDs each with a different ORCID (OAX disambiguation error). Both at ANU (I114017466). FOR=Ecological Applications matches climate/hydrology/plant-water topics. Keeping dominant works_count record (wc=68 vs 48).
DE170100716_PuGao,https://openalex.org/A5103230798,resolve,OAX split record — A5103230798 has ORCID 0000-0002-6363-1681 and matches Pure Mathematics at Monash (I56590836). Other record (A5083257155) has contaminated topics (Vibration Control + Brake Systems) indicating OAX mis-attribution. wc=116 vs 91.
DE220100595_ThomasHaines,https://openalex.org/A5083188304,resolve,Cryptography/security researcher at ANU (I118347636) matches FOR=Computer Software. ORCID 0000-0003-4954-5629 confirmed. Other candidate (A5110337362 Thomas H. Haines) is a lipid membrane biologist — different middle initial and unrelated field.
DP0879291_RodneyTucker,https://openalex.org/A5109940991,resolve,"FF Federation Fellow — optical networks researcher at U Melbourne. Six OAX split records share identical photonics topics; A5109940991 has most works (123). A5024120714 (Rod Tucker, 32 works) carries ORCID 0000-0003-0567-3389 confirming identity. Three unrelated namesakes (A5110241944 R Tucker mixed topics, A5043033990 Richard P. Tucker cell biology, A5108400424 Richard Tucker neonatal) survive topic dedup and prevent automatic resolution."
FF0669159_BenedictKiernan,https://openalex.org/A5080152859,resolve,Ben is Benedict. ORCID 0000-0002-2214-4721 confirmed (Yale History). Other HC candidate A5039906006 is Brian Kiernan — different person. Splink misses Ben/Benedict as nickname equivalence.
FL180100155_HannsChristophNaegerl,https://openalex.org/A5051441525,resolve,"Austrian quantum physicist (Innsbruck). ORCID 0000-0002-7789-4431 confirmed on A5051441525 (Nägerl with umlaut). A5108212110 is a split duplicate (Naegerl ae-encoding, no ORCID). Not in HEP pool — published from Innsbruck. Family name encoding mismatch prevented blocking."
DP0344931_GaoQingLu,https://openalex.org/A5087724445,resolve,"APF. 617 works, ORCID 0000-0002-1456-6983, inst I165143802 (UQ) matches. Name mismatch: ARC 'Gao-Qing' (hyphen) vs OAX 'Gao Qing' (space) scored all G-Lu stubs equally, none reached HC threshold."
DP0772893_CAngell,https://openalex.org/A5077833846,resolve,"APF C. Austen Angell (Charles Austen Angell, ASU). ARC has only initial 'C'; A5077833846 has most works (13) and ORCID 0000-0002-8485-1480 among 4 tied candidates at p=0.783."
DP1096525_AkosSeress,https://openalex.org/A5083769806,resolve,"APF. 33 works, inst I177877127 (UWA) matches. Blocked out: OAX first_initial='á' (diacritic not stripped in parse_given) vs ARC 'a'. Bug fixed in src/utils/names.py."
DP0344070_BrunoDavid,https://openalex.org/A5001379735,resolve,"QEII. 172 works, ORCID 0000-0002-8567-6135, Archaeology/Rock Art topics match FOR=Aboriginal and Torres Strait Islander Culture+Archaeology. Other p=1.0 candidates A5005379880 and A5102738940 are marine biologists — different field."
DP110105522_YanTan,https://openalex.org/A5040348397,resolve,"QEII. 63 works, ORCID 0000-0002-4013-1713, inst I5681781 matches ARC. Migration/demography topics match FOR=Demography. 24 candidates at p=1.0; others are wrong field or single works."
DP0344462_CaiHengLi,https://openalex.org/A5074348636,resolve,"QEII. 151 works, ORCID 0000-0001-8917-9323, Pure Maths (Finite Group Theory) at UWA (I177877127). Splink blocking failure: ARC first_name_canonical='caiheng' vs OAX='heng' (max_by_len tie on 3-char tokens 'cai' vs 'heng' picks 'heng') — pair absent from links file despite matching first_initial='c'."
DP0774583_MarieLiesseLabat,https://openalex.org/A5021654852,resolve,"QEII. 179 works, ORCID 0000-0001-7082-6076, h-index 37. ARC records surname as 'Labat' only; OAX compound surname is 'Asselin-Labat' — name truncation caused complete blocking failure."
DP0449660_ZaiGuo,https://openalex.org/A5110015262,resolve,"QEII. 1655 works, ORCID 0000-0003-0134-0210, h-index 191, UniSA (I204824540). ARC name 'Zai Guo' is truncation of 'Zaiping Guo'; OAX display_name drifted to 'Zhanhu Guo' — both truncation and display_name change caused complete blocking failure."
DP0345219_MingXingZhang,https://openalex.org/A5100621291,resolve,"ARF. 301 works, ORCID 0000-0001-8363-6968, Aluminum/Magnesium alloys at UQ (I165143802). Pipeline resolves to stub A5045540870 (1 work, Unicode-hyphen 'Ming‐Xing Zhang') which wins on name similarity; override needed to pick correct record."
DP0666231_NagarajanValanoor,https://openalex.org/A5071389289,resolve,"ARF. 262 works, ORCID 0000-0003-2534-5868, h-index 47, ferroelectrics/multiferroics at UNSW (I31746571). OAX display_name 'V. Nagarajan' — name order reversal (Nagarajan=given, Valanoor=family) caused blocking failure: ARC family='valanoor' vs OAX family='nagarajan'."
DP0452296_ZhongChen,https://openalex.org/A5062385838,resolve,"ARF. 117 works, ORCID 0000-0001-5341-6913, geology/paleontology at UWA (I177877127). OAX name 'Zhong-Qiang Chen' — deferred candidates were unrelated Zhong Chens; correct record absent from links file (Splink gap)."
DP0984797_KiyoshiOzawa,https://openalex.org/A5027755879,resolve,"ARF. 130 works (37 in AU-attributed Feb26 subset), h-index 32, biotechnology. Two p=1.0 candidates; A5027755879 confirmed. A5112080895 (batteries/condensed matter topics) is a different person."
DP0449756_SharonAllen,https://openalex.org/A5112797021,resolve,"ARF. 54 works (39 in AU-attributed subset), h-index 24, geology. OAX name 'S. R. Allen' — in links at p=0.959 (HC) but deferred among 7 HC candidates (Sharon Allen x2, Simon, Stuart, Stephen etc); field/inst disambiguation couldn't isolate the correct record."
DE210100263_WeiLi,https://openalex.org/A5100318462,resolve,"ARF. 131 works, ORCID 0000-0003-4731-3226 confirmed (sydney.edu.au). Scheduling/Distributed/Sustainable Computing at USyd (School of Computer Science). ARC insts are prior positions (ANU/UNSW); OAX topics skew Smart Grid/IoT so field score didn't resolve."
DP0346380_BaukeNauta,https://openalex.org/A5020857477,resolve,"ARF. 60 works, ORCID 0000-0003-1292-7973 at UNSW (I129604602). OAX name 'Klaas Nauta' — ARC records given name as 'Bauke'; ORCID registered as 'Klaas' (Dutch naming: different given name used in different contexts). Field match unambiguous: spectroscopy/quantum helium dynamics/molecular physics."
DE190101397_JarrydPla,https://openalex.org/A5048713725,resolve,"FT. 36 works, ORCID 0000-0002-7152-3453 confirmed, quantum physics. OAX name garbled to 'J. Jarryd' (Pla mis-parsed as first name, Jarryd as last) — family mismatch; ORCID block found the pair but scored only p=0.683."
DP250101568_ThomasEvansSoma,https://openalex.org/A5050627999,resolve,"FT. 131 works, ORCID 0000-0001-5442-1300 confirmed, astronomical sciences. OAX name 'T. M. Evans' — hyphenated surname Evans-Soma truncated to Evans; family mismatch; ORCID block connected at p=0.683."
FT120100008_TerenceOKane,https://openalex.org/A5006843590,resolve,"FT. 33 works, ORCID 0000-0002-2137-5915 confirmed, oceanography/climate. OAX name 'T. Okane' — initial-only first name gave low score p=0.683 below HC threshold."
FT150100347_PetrCejka,https://openalex.org/A5056096904,resolve,"FT. 153 works, ORCID 0000-0002-9087-032X confirmed, h-index 48, DNA repair/biochemistry. OAX name 'Petr Ćejka' (diacritic on Ć). Absent from AU prep (overseas-based, not in Australian author subset)."
DP0209429_JohnPiggott,https://openalex.org/A5103238089,resolve,"APF. 102 works, ORCID 0000-0001-7529-657X, pension/retirement/fiscal economics at UNSW (I31746571). Other p=1.0 candidate A5084415133 is a food scientist — wrong field."
DP0664925_AntonyUnderwood,https://openalex.org/A5112808684,resolve,"APF. 226 works, marine ecology (A.J. Underwood), UNSW (I129604602). A5111560298 (12 works, same UNSW inst) is a small split record of the same person."
DE250101462_YongZhao,https://openalex.org/A5069069316,resolve,"APF. 209 works, ORCID 0000-0002-8774-3629, superconducting materials at UNSW (I31746571). 46 Yong Zhao candidates at p=1.0; this is the largest works_count at the matching institution."
DP180103740_LukeDavies,https://openalex.org/A5029546235,resolve,"FT. 189 works, ORCID 0000-0003-3085-0922, h-index 44, galaxy evolution/astronomy at UWA (I177877127). OAX display_name 'L. J. M. Davies' — initial-only first name scored p=0.949 below HC threshold; deferred as common name."
DP170101403_MelissaGreen,https://openalex.org/A5086121026,resolve,"FT. 450 works, ORCID 0000-0002-9361-4874, h-index 65, psychiatric genetics/schizophrenia research at UNSW (I31746571). OAX full_name 'Melissa Jane Green'. Deferred: multiple HC Melissa Green candidates; this is by far the largest works_count at the matching inst."
FT160100360_KojiTanaka,https://openalex.org/A5002528469,resolve,"FT. 12 works, ORCID 0000-0003-4747-3457, Philosophy and Buddhist/Indian Studies at ANU (I118347636) matches FOR=Philosophy. Other ANU candidate is a materials chemist — unambiguous."
FT130100510_WeihuaLiu,https://openalex.org/A5058829648,resolve,"FT. 78 works, ORCID 0000-0002-2091-7137, radioactive element chemistry and hydrocarbon exploration topics match FOR=Geochemistry. Inst overlap: I1292875679 (CSIRO). Other candidates have no inst overlap and wrong fields."
DE150101617_DanLiu,https://openalex.org/A5100326855,resolve,"FT. 97 works, ORCID 0000-0002-7742-4368, battery materials/supercapacitors/electrocatalysts match FOR=Materials Engineering+Nanotechnology. Both ARC insts I149704539+I82951845 match OAX — other candidates match at most one inst and have different topics."
DE160100147_CeciliaGonzalezTokman,https://openalex.org/A5079769493,resolve,"FT. 25 works, applied maths dynamics/fractals topics match FOR=Applied Mathematics. Blocking failure: ARC family_name_main='gonzalez tokman' (space) vs OAX 'gonzalez-tokman' (hyphen) — compound surname with different separator."
DP120100606_MohammadJalalAbbasiShavazi,https://openalex.org/A5029752779,resolve,"FT. 39 works, ORCID 0000-0002-8647-376X, demography/fertility topics match FOR=Demography. Blocking failure: ARC 'abbasi shavazi' (space) vs OAX 'abbasi-shavazi' (hyphen)."
DP0880801_CraigONeill,https://openalex.org/A5037735809,resolve,"FT. 96 works, ORCID 0000-0002-6034-1881, geology/geophysics topics match FOR=Geology. Blocking failure: ARC family_name_main='o'neill' (ASCII apostrophe preserved) vs OAX 'oneill' (Unicode right-quote stripped by strip_diacriticals)."
DP160101379_DenisOCarroll,https://openalex.org/A5066567292,resolve,"FT. 93 works, ORCID 0000-0001-6557-226X, chemical/civil engineering matches FOR. Blocking failure: same Unicode apostrophe issue — ARC 'o'carroll' vs OAX 'ocarroll'."
FT120100913_HuaguiYang,https://openalex.org/A5100770981,resolve,"FT. 152 works, ORCID 0000-0003-0436-8622, photocatalysis/physical chemistry topics match FOR=Physical Chemistry. OAX name 'Hua Gui Yang' — space-separated compound given name vs ARC 'Huagui'; scored p=0.681 below HC threshold."
FT0991314_AndrewMartin,https://openalex.org/A5017756615,resolve,"FT. 306 works, ORCID 0000-0001-5504-392X, Education/Motivation/Giftedness topics match FOR=Specialist Studies In Education; UNSW (I31746571) confirmed in OAX inst list. OAX display_name 'Andrew J. Martin' scored p=0.998 vs p=1.0 plain-name UNSW candidates — probability step excluded this dominant record (306 vs 35 combined works)."
DP0664967_AndrewLowe,https://openalex.org/A5059818650,resolve,"FT. 213 works, ORCID 0000-0003-1139-2516, Genetic diversity/Ecology/Species Distribution match FOR=Evolutionary Biology+Genetics. Works_count dominance failed: 213/(213+80+...)=0.676 < TOP_CUT=0.7 due to polymer chemist Andrew B. Lowe (80 works). Clearly the right person by field."
FT110100305_VishwanathanSwaminathan,https://openalex.org/A5013623933,resolve,"FT. 142 works, h-index 36, AI/ML (known as 'Vishy Vishwanathan', 'S. V. N. Vishwanathan') matches FOR=AI. Name-order reversal: ARC family='swaminathan' vs OAX family='vishwanathan' — complete blocking failure. Not in AU prep under ARC name form."
DP0666551_KristianKrabbenhoft,https://openalex.org/A5073968971,resolve,"FT. 126 works, ORCID 0000-0003-0889-059X, h-index 36, geomechanics/civil engineering matches FOR=Civil Engineering. OAX display_name 'K. Krabbenhøft' — ø does not NFD-decompose so strip_diacriticals strips it entirely: OAX family_name_main='krabbenhft' vs ARC 'krabbenhoft' (missing 'o') → blocking failure."
FT110100339_FrederikVercauteren,https://openalex.org/A5032574536,resolve,"FT. 175 works, ORCID 0000-0002-7208-9599, h-index 42, cryptography/lattice-based crypto matches FOR=Data Format. Absent from AU prep (KU Leuven, no Australian inst affiliation). OAX name 'Fréderik Vercauteren' — é decomposes correctly so name blocking would succeed, but record not in AU subset."
FT120100533_JanRueger,https://openalex.org/A5005781806,resolve,"FT. 47 works, ORCID 0000-0001-8583-1089, h-index 14, Historical Studies at ANU (I118347636). OAX name 'Jan Rüger' — strip_diacriticals strips ü to 'u' giving 'ruger', but ARC uses German ue-transliteration 'rueger' → blocking failure. Absent from AU prep (humanities, limited HEP-context works)."
FT130101941_DianaMarculescu,https://openalex.org/A5065985595,resolve,"FT. 384 works, ORCID 0000-0002-5734-4221, h-index 46, computer engineering/AI matches FOR=Computer Software. Absent from AU prep (Carnegie Mellon / UT Austin, no Australian inst affiliation). Name is clean — would block correctly if in AU subset."
LP100200430_JayavardhanaRamaGubbiLakshminarasimha,https://openalex.org/A5077902462,resolve,"APDI. 131 works, ORCID 0000-0001-5833-1898, h-index 24, IoT/computer vision/AI matches FOR=AI. OAX display_name 'Jayavardhana Gubbi' — ARC records full patronymic 'Lakshminarasimha' as family name; OAX uses publication name 'Gubbi': family_name_main 'lakshminarasimha' vs 'gubbi' → complete blocking failure."
LP110200144_SiobhanOSullivan,https://openalex.org/A5101776282,resolve,"APDI. 106 works, ORCID 0000-0003-4705-1182, human-animal geography/social policy at I165779595+I129604602 matches FOR=Policy and Administration. OAX name 'Siobhán O'Sullivan' — same Unicode apostrophe stripping issue as O'Neill/O'Carroll: ARC 'o'sullivan' vs OAX 'osullivan'. A5101776279 (6 works, same insts) is a split record."
LP110201151_BallardBlair,https://openalex.org/A5079335718,resolve,"APDI. 14 works, Maritime Engineering at I129604602. Name parses cleanly (family='blair', init='b') but absent from AU prep (low-output engineer, not in HEP context)."
FT0991956_MingBoWang,https://openalex.org/A5055855869,resolve,"FT. 230 works, ORCID 0000-0002-3979-3103, h-index 50, RNA silencing/plant genetics at CSIRO (I1292875679) matches FOR=Genetics. OAX display_name 'Ming‐Bo Wang' uses Unicode non-breaking hyphen (U+2010) — strip_diacriticals maps this to ASCII hyphen so name parsing is correct, but record absent from AU prep."
FT120100612_YingziJennyWang,https://openalex.org/A5031528165,resolve,"FT. 251 works, ORCID 0000-0002-1325-7943, h-index 36, oncology/cancer biology at UNSW (I31746571) matches FOR=Oncology. OAX display_name 'Jenny Wang' (English name) vs ARC 'Yingzi (Jenny) Wang' (Chinese given name primary) — first_initial 'j' vs 'y' → complete blocking failure on given-name alias pair."
DE200101840_XuHuang,https://openalex.org/A5002681207,resolve,"FT. 551 works, ORCID 0000-0002-5895-2253, h-index 74. OAX display_name 'Xu‐Feng Huang'; raw_author_names include 'Xu Huang' matching ARC. Scoring failure: OAX first_name_canonical='feng' (max_by_len picks 'feng' over 'xu') vs ARC 'xu' → pair scored below 0.5 and absent from links file."
FT110101007_LarissaHeinrich,https://openalex.org/A5038233210,resolve,"FT. 20 works, h-index 5, Literary Studies. ARC ORCID 0000-0003-2327-5691 not registered in OAX so ORCID force-add didn't fire. Name match is clean but absent from AU prep (humanities publications not in HEP context)."
DP0985450_YanboWang,https://openalex.org/A5100452596,resolve,"FT. 175 works, ORCID 0000-0002-6061-7577, h-index 52, perovskites/quantum dots/nanomaterials at UNSW (I129604602) matches FOR=Materials Engineering+Nanotechnology. Deferred: both A5100452596 (materials) and A5100452610 (food allergy) have UNSW overlap and identical 3-work AU-prep counts — field score filter didn't separate them."
FT0991222_YueshengLi,https://openalex.org/A5108093899,resolve,"FT. 38 works, h-index 25, Clinical Sciences at UQ (I165143802). Deferred: two similar Yuesheng Li candidates with comparable works counts (~37 vs ~32), no ORCID on either, no ARC inst recorded — pipeline had no disambiguation signal."
DP140101841_JenniferHocking,https://openalex.org/A5034715108,resolve,"CI-DORA. 44 works, h-index 7, Australian historian (Whitlam biographer). ARC ORCID 0000-0003-0254-4426 not in OAX so ORCID step didn't fire. Publishes as 'Jenny Hocking'; A5046065175 ('Jennifer Jane Hocking', 42 works, same h-index) is an OAX split record of the same person."
DE120100390_NatalieKeirstead,https://openalex.org/A5040848887,resolve,"DECRA. 37 works, h-index 16, oncology/veterinary immunology (Complement system, T-cell/B-cell, Animal Virus) matches FOR=Oncology+Veterinary Sciences. Not in AU HEP filter; no AU co-authors in indexed works."
DE120100901_RobertYuncken,https://openalex.org/A5066528318,resolve,"DECRA. 50 works, ORCID 0000-0002-2747-3276, Operator Algebra/Homotopy/Algebraic Topology topics match FOR=Pure Mathematics. Not in AU HEP filter."
DE130100457_GaoFengZhao,https://openalex.org/A5088306136,resolve,"DECRA. 268 works, ORCID 0000-0001-9962-8743 confirmed (Scopus 55234790300), Rock Mechanics/Drilling/Tunneling topics match FOR=Civil Engineering; Tianjin University current affiliation. OAX name 'Gao‐Feng Zhao' uses Unicode en-dash — first_name_canonical mismatch prevented blocking. A5113591844 is a split record (same rock mechanics topics, 29 works)."
DE130100739_AdrianDAlfonso,https://openalex.org/A5109144013,resolve,"DECRA. 19 works in AU prep (21 total), Electron Microscopy/X-ray Spectroscopy/Electronic Properties of Oxides match FOR=Condensed Matter Physics at U Melbourne (I165779595). OAX name uses Unicode right-quote (U+2019) → family_name_main='dalfonso'; ARC has ASCII apostrophe → 'd'alfonso' — different strings, blocking fails. A5053709945 ('Adrian J. D' Alfonso', space variant, 3 works) is a split record."
DE140100932_DavidEstruchSamper,https://openalex.org/A5044944488,resolve,"DECRA. 32 works, ORCID 0000-0001-6392-9691, Fluid Dynamics/Computational Fluid Dynamics/Aerodynamics topics match FOR=Aerospace Engineering at UQ (I165143802). Not in AU HEP filter."
DE140101096_MargarethaVanDerMerwe,https://openalex.org/A5030344944,resolve,"DECRA. 25 works, ORCID 0000-0003-0747-3954, Plant nutrient uptake/Plant Molecular Biology/Photosynthesis topics match FOR=Plant Biology at UWA (I177877127). Blocking failure: ARC 'vandermerwe' (no spaces) vs OAX 'van der merwe' — family_name_main strings differ. A5008339048 ('Margaretha van der Merwe', 3 works, same plant topics) is a split record."
DE140101749_SimonDeDeyne,https://openalex.org/A5058212304,resolve,"DECRA. 130 works, ORCID 0000-0002-7899-6210, Neurobiology of Language/NLP/Language Cognition topics match FOR=Linguistics at U Melbourne (I165779595). Blocking failure: ARC 'dedeyne' vs OAX 'de deyne' — space in compound surname causes family_name_main mismatch."
DE150101512_NangallageFernando,https://openalex.org/A5073991989,resolve,"DECRA. 162 works, ORCID 0000-0001-7481-7935, h-index 28, Structural/Reinforced Concrete/Geotechnical Engineering topics match FOR=Civil Engineering. Now at U Edinburgh. ARC name 'Nangallage Fernando' — 'Nangallage' is a Sinhalese patronymic; publishes as 'Dilum Fernando'. A5082553254 ('Nangallage Dilum Fernando', 1 work, same structural topics, 105 citations) is a split record."
DE150101612_KatrinaOLoughlin,https://openalex.org/A5073865700,resolve,"DECRA. 35 works, ORCID 0000-0002-1476-8454, Travel Writing/Literature/Colonial History topics match FOR=Literary Studies. Not in AU HEP filter. Sub-threshold candidate A5112197476 ('Kathleen T O'Loughlin', dental/pelvic floor topics) is a different person — topic-rejected."
DE170100361_XuanVinhNguyen,https://openalex.org/A5000403961,resolve,"DECRA. 190 works, ORCID 0000-0002-7275-750X confirmed (scholar.google.com.au), Machine Learning/Data Science at U Melbourne matches FOR=AI and Image Processing. OAX entity contaminated by disambiguation error merging aerospace papers from another Nguyen Xuan Vinh — field mismatch caused scoring failure. ORCID is definitive."
DE170101438_JaideepSaha,https://openalex.org/A5074342149,resolve,"DECRA. 73 works, ORCID 0000-0002-1505-5130, Catalytic C-H Functionalization/Asymmetric Synthesis/Crystallography topics match FOR=Organic Chemistry at U Adelaide (I118347636). No AU affiliation in OAX (published from prior US/India positions); not in AU HEP filter."
DE190101011_FlorentSzitkar,https://openalex.org/A5037748575,resolve,"DECRA. 55 works, ORCID 0000-0002-7614-1235, Geomagnetism/Paleomagnetism/Geological Analysis topics match FOR=Geology at Curtin (I129801699). Not in AU HEP filter."
DE190101190_JosephSanzo,https://openalex.org/A5040513508,resolve,"DECRA. 41 works, ORCID 0000-0002-0289-1340 exact ARC match, Religion/Religious Studies/Scripture topics match FOR=Religion and Religious Studies at UQ (I165143802). Not in AU HEP filter (humanities). Second OAX fragment exists."
DE190101241_GuangboXu,https://openalex.org/A5048986405,resolve,"DECRA. 38 works, ORCID 0000-0002-1053-1126 exact ARC match, Geometric/Algebraic Topology/Homotopy/Algebraic Geometry topics match FOR=Pure Mathematics at Macquarie (I129604602). Not in AU HEP filter; sub-threshold candidate A5070107268 ('Gemma Xu', folate research) is a different person — topic-rejected."
DE220100311_RiikkaArppeTabbara,https://openalex.org/A5060503107,resolve,"DECRA. 26 works, ORCID 0000-0002-9930-1676 exact ARC match (OAX name 'Riikka Arppe' — married name Tabbara added post-publication). Luminescence/Biosensing/Lanthanide Complexes topics match FOR=Medical Biotechnology at U Adelaide (I5681781). Not in AU HEP filter."
DE230101042_PraveenaThirunavukkarasu,https://openalex.org/A5041417164,resolve,"DECRA. 21 works, h-index 11, Immune Cell Function/T-cell/B-cell/CAR-T therapy topics match FOR=Biochemistry and Cell Biology at Monash (I56590836) + Australian Regenerative Medicine Institute. OAX display_name 'T. Praveena' — name-order reversal: South Indian naming where Thirunavukkarasu is given and Praveena is used as family in OAX; raw_author_names include both orderings. ARC ORCID absent from OAX record."
DE250101329_VanditaPatel,https://openalex.org/A5064940336,resolve,"DECRA. 27 works, ORCID 0000-0003-0252-963X exact ARC match, Algebraic Geometry/Number Theory/Coding Theory topics match FOR=Pure Mathematics at UNSW (I31746571). Not in AU HEP filter. Three sub-threshold candidates (Vishal/Vikram/Vyoma Patel) all medicine/health — topic-rejected."
DE120101588_AsadulIslam,https://openalex.org/A5011364024,resolve,"DECRA. 119 works h=33. FOR=Applied Economics: Poverty/Education/Child Welfare + Microfinance/Financial Inclusion topics — development economics. Dominant by works_count and topic alignment among 6 candidates."
DE120102857_NicholasShepherd,https://openalex.org/A5073843324,resolve,"DECRA. 33 works. FOR=Biochemistry and Cell Biology: Molecular Biology subfield, RNA/protein synthesis + asymmetric synthesis topics. Other candidate A5011650794 is inorganic crystallography/MOFs — topic-rejected."
DE120100501_YuanTian,https://openalex.org/A5101619012,resolve,"DECRA. 1 work (HEP-filtered). ORCID 0000-0002-5030-6249, Griffith University (I11701301). FOR=Banking Finance Investment: Market Dynamics/Volatility + Climate Change Policy Economics topics. Research on Asian financial markets/holiday effect/ADRs. Pipeline miss: pair scored <0.5 due to low wc + common name + no ARC ORCID. None of 25 deferred candidates match field."
DE130100255_DavidJohnston,https://openalex.org/A5044682219,resolve,"DECRA. 565 works, h=33, ORCID 0000-0002-0678-3902. FOR=Applied Economics: forensic accountant; OAX topics Criminal Law/Evidence reflect publication in law journals for forensic accounting work. Only plausible candidate among 7."
DE130100488_YanYan,https://openalex.org/A5100718883,resolve,"DECRA. 55 works. FOR=Nanotechnology: Nanoparticle Drug Delivery/Polymer Surface/RNA Interference/Nanoplatforms — nanomedicine. AU institutions UQ (I20231570) + RMIT (I242743682) + Melbourne (I6289922). Dominant topic-and-institution match among 26 candidates."
DE130100806_AartiSingh,https://openalex.org/A5100758183,resolve,"DECRA. 22 works. FOR=Applied Economics: Monetary Policy/Economic theories/Economic Theory and Policy topics — clear economics match. Other 3 candidates are cloud computing, mitochondria, signal processing — topic-rejected."
DE130100943_PengWang,https://openalex.org/A5100395938,resolve,"DECRA. 100 works. FOR=Soil Sciences: Heavy Metals in Environment + Plant Stress Responses — soil contamination/phytoremediation profile. Best topic alignment among 39 candidates."
