cluster_id,n_grants,names,orcids,institutions,for_names,grant_ids,confirmed_different_people,notes
DP0342703_KimbalMarriott,11,Kimbal Marriott,,The University of Sydney; The University of Melbourne; Monash University,Architecture; Artificial Intelligence and Image Processing; Computer Software; Historical Studies; Human-Centred Computing; Information Systems,DP0449546_KimbalMarriott; DP0342703_KimbalMarriott; DP220101221_KimbalMarriott; LP180101048_KimbalMarriott; LP240100506_KimbalMarriott; DP240100824_KimbalMarriott; LP170100026_KimbalMarriott; DP180100755_KimbalMarriott; DP140100077_KimbalMarriott; LP110200469_KimbalMarriott; DP0987168_KimbalMarriott,,
DP0451045_QuentinParker,5,Quentin Parker,,The Australian National University; Macquarie University,Astronomical and Space Sciences; Curriculum and Pedagogy,DP0772283_QuentinParker; DP0451045_QuentinParker; DP120104416_QuentinParker; DP120103751_QuentinParker; LP0989264_QuentinParker,,
DP0559004_GrahamSchaffer,5,Graham Schaffer,,The University of Queensland; The University of Melbourne; Swinburne University of Technology,Materials Engineering; Sociology,LP200301355_GrahamSchaffer; LP180100122_GrahamSchaffer; DP0559004_GrahamSchaffer; LP0455125_GrahamSchaffer; DP0986042_GrahamSchaffer,,
DP0559655_DesleyConnell,4,Desley Connell,,Queensland University of Technology; The University of Queensland,Building; Other Chemical Sciences; Public Health and Health Services,LP0349155_DesleyConnell; DP0559655_DesleyConnell; LP0453669_DesleyConnell; DP1095752_DesleyConnell,,
LP0219314_JohnOToole,4,John O'Toole,,Griffith University; The University of Melbourne,Curriculum and Pedagogy; Performing Arts and Creative Writing; Specialist Studies In Education,LP0219314_JohnOToole; LP0776532_JohnOToole; LP0775023_JohnOToole; LP0562431_JohnOToole,,
DP0343998_AlexanderRubinov,3,Alexander Rubinov,,Federation University Australia; The University of New South Wales,Applied Mathematics; Architecture; Numerical and Computational Mathematics,DP0343998_AlexanderRubinov; DP0450151_AlexanderRubinov; LP0669752_AlexanderRubinov,,
DP0556065_JenniferODea,3,Jennifer O'Dea,,The University of Sydney; The University of New South Wales,Cultural Studies; Public Health and Health Services,DP0667170_JenniferODea; DP0556065_JenniferODea; DP110105115_JenniferODea,,
DP110100881_TheodorusSloots,2,Theodorus Sloots,,The University of Sydney; The University of Queensland,Microbiology; Sociology,DP110100881_TheodorusSloots; LP0884126_TheodorusSloots,,
